{
  "schemaVersion": "2.0.0",
  "reviewedAt": "2026-10-13T18:07:44+09:00",
  "source": {
    "kind": "operator-reviewed-directory",
    "note": "공개 가능한 링크와 접근 유형만 포함한 정적 디렉터리입니다. 실시간 상태나 운영 권한을 제공하지 않습니다."
  },
  "items": [
    {
      "id": "worker-0",
      "kind": "worker",
      "title": "Worker 0",
      "summary": "DreamLabs 공통 업무를 위한 Worker 진입점입니다.",
      "url": "https://worker0.workers.dreamlabs.co.kr/",
      "audiences": ["team"],
      "tags": ["general", "dreamlabs"],
      "access": "login-required",
      "exposure": "public-listable",
      "availability": "https-observed",
      "linkReview": { "expected": "authenticated-response", "observedAt": "2026-10-13T18:07:44+09:00" },
      "actions": [{ "label": "Worker 열기", "url": "https://worker0.workers.dreamlabs.co.kr/" }]
    },
    {
      "id": "worker-1",
      "kind": "worker",
      "title": "Worker 1",
      "summary": "DreamLabs 공통 업무를 위한 Worker 진입점입니다.",
      "url": "https://worker1.workers.dreamlabs.co.kr/",
      "audiences": ["team"],
      "tags": ["general", "dreamlabs"],
      "access": "login-required",
      "exposure": "public-listable",
      "availability": "https-observed",
      "linkReview": { "expected": "authenticated-response", "observedAt": "2026-10-13T18:07:44+09:00" },
      "actions": [{ "label": "Worker 열기", "url": "https://worker1.workers.dreamlabs.co.kr/" }]
    },
    {
      "id": "claude-worker",
      "kind": "worker",
      "title": "Claude Worker",
      "summary": "Claude 실행 환경을 사용하는 Worker 진입점입니다.",
      "url": "https://claude-worker.workers.dreamlabs.co.kr/",
      "audiences": ["team", "developer"],
      "tags": ["general", "development"],
      "access": "login-required",
      "exposure": "public-listable",
      "availability": "https-observed",
      "linkReview": { "expected": "authenticated-response", "observedAt": "2026-10-13T18:07:44+09:00" },
      "actions": [{ "label": "Worker 열기", "url": "https://claude-worker.workers.dreamlabs.co.kr/" }]
    },
    {
      "id": "dl-sales-worker",
      "kind": "worker",
      "title": "DL Sales Worker",
      "summary": "DreamLabs 영업 업무를 지원하는 Worker 진입점입니다.",
      "url": "https://dl-sales-worker.workers.dreamlabs.co.kr/",
      "audiences": ["sales", "team"],
      "tags": ["sales", "dreamlabs"],
      "access": "access-controlled",
      "exposure": "public-listable",
      "availability": "https-observed",
      "linkReview": { "expected": "application-shell", "observedAt": "2026-10-13T18:07:44+09:00" },
      "actions": [{ "label": "Worker 열기", "url": "https://dl-sales-worker.workers.dreamlabs.co.kr/" }]
    },
    {
      "id": "dl-dev-worker",
      "kind": "worker",
      "title": "DL Dev Worker",
      "summary": "DreamLabs 개발 업무를 지원하는 Worker 진입점입니다.",
      "url": "https://dl-dev-worker.workers.dreamlabs.co.kr/",
      "audiences": ["developer", "team"],
      "tags": ["development", "dreamlabs"],
      "access": "access-controlled",
      "exposure": "public-listable",
      "availability": "https-observed",
      "linkReview": { "expected": "application-shell", "observedAt": "2026-10-13T18:07:44+09:00" },
      "actions": [{ "label": "Worker 열기", "url": "https://dl-dev-worker.workers.dreamlabs.co.kr/" }]
    },
    {
      "id": "wc-dev-worker",
      "kind": "worker",
      "title": "WC Dev Worker",
      "summary": "WCamper 개발 업무를 지원하는 Worker 진입점입니다.",
      "url": "https://wc-dev-worker.workers.dreamlabs.co.kr/",
      "audiences": ["developer", "team"],
      "tags": ["development", "wcamper"],
      "access": "access-controlled",
      "exposure": "public-listable",
      "availability": "https-observed",
      "linkReview": { "expected": "application-shell", "observedAt": "2026-10-13T18:07:44+09:00" },
      "actions": [{ "label": "Worker 열기", "url": "https://wc-dev-worker.workers.dreamlabs.co.kr/" }]
    },
    {
      "id": "support-worker",
      "kind": "worker",
      "title": "Support Worker",
      "summary": "지원 업무 요청을 처리하는 Worker 진입점입니다.",
      "url": "https://support-worker.workers.dreamlabs.co.kr/",
      "audiences": ["support", "team"],
      "tags": ["support", "dreamlabs"],
      "access": "access-controlled",
      "exposure": "public-listable",
      "availability": "https-observed",
      "linkReview": { "expected": "application-shell", "observedAt": "2026-10-13T18:07:44+09:00" },
      "actions": [{ "label": "Worker 열기", "url": "https://support-worker.workers.dreamlabs.co.kr/" }]
    },
    {
      "id": "worker-developer",
      "kind": "worker",
      "title": "Worker Developer",
      "summary": "Worker 개발 업무를 위한 전용 진입점입니다.",
      "url": "https://dl-worker-developer.workers.dreamlabs.co.kr/",
      "audiences": ["developer"],
      "tags": ["development", "worker-host"],
      "access": "login-required",
      "exposure": "public-listable",
      "availability": "https-observed",
      "linkReview": { "expected": "native-login-redirect", "observedAt": "2026-10-13T18:07:44+09:00" },
      "actions": [{ "label": "Worker 열기", "url": "https://dl-worker-developer.workers.dreamlabs.co.kr/" }]
    },
    {
      "id": "worker-host",
      "kind": "product",
      "title": "Worker Host",
      "summary": "역할별 Worker 실행 기반과 제품 구조를 소개합니다.",
      "url": "https://worker-host.dreamlabs.co.kr/",
      "audiences": ["user", "operator", "developer"],
      "tags": ["product", "architecture"],
      "access": "public",
      "exposure": "public-listable",
      "availability": "https-observed",
      "linkReview": { "expected": "http-200", "observedAt": "2026-10-13T18:07:44+09:00" },
      "actions": [
        { "label": "소개 보기", "url": "https://worker-host.dreamlabs.co.kr/" },
        { "label": "전체 구조", "url": "https://worker-host.dreamlabs.co.kr/#architecture" }
      ]
    },
    {
      "id": "workerops-overview",
      "kind": "product",
      "title": "왜 WorkerOps인가",
      "summary": "Worker를 계속 운영하기 위한 역할, 지침, 권한과 변경 책임을 설명합니다.",
      "url": "https://worker-host.dreamlabs.co.kr/why-workerops/",
      "audiences": ["user", "operator", "leader"],
      "tags": ["workerops", "operations"],
      "access": "public",
      "exposure": "public-listable",
      "availability": "https-observed",
      "linkReview": { "expected": "http-200", "observedAt": "2026-10-13T18:07:44+09:00" },
      "actions": [{ "label": "WorkerOps 이해하기", "url": "https://worker-host.dreamlabs.co.kr/why-workerops/" }]
    },
    {
      "id": "workerops-in-action",
      "kind": "product",
      "title": "WorkerOps 운영 장면",
      "summary": "인계, 지침, 권한, 복구와 승인형 협업을 실제 운영 관점에서 살펴봅니다.",
      "url": "https://worker-host.dreamlabs.co.kr/workerops-in-action/",
      "audiences": ["operator", "leader", "developer"],
      "tags": ["workerops", "operations", "evidence"],
      "access": "public",
      "exposure": "public-listable",
      "availability": "https-observed",
      "linkReview": { "expected": "http-200", "observedAt": "2026-10-13T18:07:44+09:00" },
      "actions": [{ "label": "운영 장면 보기", "url": "https://worker-host.dreamlabs.co.kr/workerops-in-action/" }]
    },
    {
      "id": "worker-gateway",
      "kind": "service",
      "title": "Worker Gateway",
      "summary": "보호된 Worker 주소에 DreamLabs 인증을 적용하는 접근 경계입니다.",
      "url": "https://workers.dreamlabs.co.kr/oauth2/sign_in",
      "audiences": ["user", "operator"],
      "tags": ["authentication", "gateway"],
      "access": "login-required",
      "exposure": "public-listable",
      "availability": "https-observed",
      "linkReview": { "expected": "sign-in-page", "observedAt": "2026-10-13T18:07:44+09:00" },
      "actions": [{ "label": "로그인 화면", "url": "https://workers.dreamlabs.co.kr/oauth2/sign_in" }]
    },
    {
      "id": "worker-meet",
      "kind": "service",
      "title": "Worker Meet",
      "summary": "사람과 에이전트가 함께 회의하고 협업하는 별도 서비스입니다.",
      "url": "https://worker-meet.dreamlabs.co.kr/",
      "audiences": ["user", "team"],
      "tags": ["meeting", "collaboration"],
      "access": "login-required",
      "exposure": "public-listable",
      "availability": "https-observed",
      "linkReview": { "expected": "application-shell", "observedAt": "2026-10-13T18:07:44+09:00" },
      "actions": [{ "label": "Worker Meet 열기", "url": "https://worker-meet.dreamlabs.co.kr/" }]
    },
    {
      "id": "worker-manual",
      "kind": "guide",
      "title": "Worker Manual",
      "summary": "화면 위치, 조작 순서, 기대 결과와 테스트 방법을 안내합니다.",
      "url": "https://manual.workers.dreamlabs.co.kr/",
      "audiences": ["user", "administrator"],
      "tags": ["manual", "guide"],
      "access": "public",
      "exposure": "public-listable",
      "availability": "https-observed",
      "linkReview": { "expected": "http-200", "observedAt": "2026-10-13T18:07:44+09:00" },
      "actions": [{ "label": "매뉴얼 열기", "url": "https://manual.workers.dreamlabs.co.kr/" }]
    },
    {
      "id": "dreamlabs-assets",
      "kind": "standard",
      "title": "DreamLabs Assets",
      "summary": "DreamLabs 브랜드, Worker 아이콘, 제품 로고와 푸터 자산의 승인 상태를 제공합니다.",
      "url": "https://assets.dreamlabs.co.kr/",
      "audiences": ["designer", "developer", "qa"],
      "tags": ["brand", "assets", "catalog"],
      "access": "public",
      "exposure": "public-listable",
      "availability": "https-observed",
      "linkReview": { "expected": "http-200", "observedAt": "2026-10-13T18:07:44+09:00" },
      "actions": [{ "label": "Asset Pack 열기", "url": "https://assets.dreamlabs.co.kr/" }]
    },
    {
      "id": "hr-system",
      "kind": "business-system",
      "title": "DreamLabs HR System",
      "summary": "조직과 역할 정보를 확인하는 별도 업무 시스템입니다.",
      "url": "https://hr.dreamlabs.co.kr/",
      "audiences": ["team", "administrator"],
      "tags": ["organization", "roles", "connected-system"],
      "access": "access-controlled",
      "exposure": "public-listable",
      "availability": "https-observed",
      "linkReview": { "expected": "application-shell", "observedAt": "2026-10-13T18:07:44+09:00" },